workerid,strong_adjective,not_paid_attention,condition_prosody,responsequestion,exchange,question,pre_check_response,condition_knowledge,weak_adjective,context,time,num_plays,response,slide_number_in_experiment,language,enjoyment,gender,age,comments,asses,education,OS,screenH,screenW,Browser,hitid,hittypeid,title,description,keywords,reward,creationtime,assignments,numavailable,numpending,numcomplete,hitstatus,reviewstatus,annotation,assignmentduration,autoapprovaldelay,hitlifetime,viewhit,assignmentid,workerid,assignmentstatus,autoapprovaltime,assignmentaccepttime,assignmentsubmittime,assignmentapprovaltime,assignmentrejecttime,deadline,feedback,reject,Answer.condition,Answer.hit_information,Answer.time_in_minutes
1,tiny,False,control,Does Julie mean that his umbrella was big?,Stan: What was his umbrella like?,Did Julie need an umbrella at the festival?,no,ignorant,big," Mike was on a festival. A few days later, he talks with his friend Julie about it. He tells her that he needed an umbrella the whole time during the festival because the weather was very bad. Despite the bad weather the festival was quite crowded. Later, Julie hangs out with her boyfriend Stan. She tells him about her talk with Mike.",9978,1,0.08,19,English,1,Female,32,,Yes,1,Windows,900,1600,Chrome,3PR3LXCWSFZK8PBUI8HBAN3IM399X8,3NWM3X0LA7LPP30KTPJPGTWNK4SXPI,Language study,"Listen to interactions and answer questions about them. You must be able to listen to short audio clips, perform this task on a desktop or laptop computer, and use Chrome, Safari, Firefox or Opera.",language research stanford fun cognitive science university,$1.60,Sat Dec 09 21:08:23 PST 2017,9,0,0,0,Reviewable,NotReviewed,1 cond,2400,60000,Mon Jan 08 21:08:23 PST 2018,https://requester.mturk.com/mturk/manageHIT?HITId=3PR3LXCWSFZK8PBUI8HBAN3IM399X8,37TRT2X24QR5NHJWPQL8Z4MHLAUBJ5,1,Submitted,Sun Dec 10 14:02:05 PST 2017,Sat Dec 09 21:08:43 PST 2017,Sat Dec 09 21:22:05 PST 2017,,,,,,undefined,undefined,11.87905
1,guilty,False,control,Does Julie mean that her sister was innocent?,Mike: What happened with your sister?,Did Julie&quotechars sister get arrested for drugs?,yes,know,innocent,Julie and her friend Mike meet for a walk in a park. They are talking about their childhood. Julie remembers that her sister was at a party where drugs were sold and she got arrested when the police came. Julie mentioned that she had a bad lawyer and went to prison for two months. ,12696,1,0.13,20,English,1,Female,32,,Yes,1,Windows,900,1600,Chrome,3PR3LXCWSFZK8PBUI8HBAN3IM399X8,3NWM3X0LA7LPP30KTPJPGTWNK4SXPI,Language study,"Listen to interactions and answer questions about them. You must be able to listen to short audio clips, perform this task on a desktop or laptop computer, and use Chrome, Safari, Firefox or Opera.",language research stanford fun cognitive science university,$1.60,Sat Dec 09 21:08:23 PST 2017,9,0,0,0,Reviewable,NotReviewed,1 cond,2400,60000,Mon Jan 08 21:08:23 PST 2018,https://requester.mturk.com/mturk/manageHIT?HITId=3PR3LXCWSFZK8PBUI8HBAN3IM399X8,37TRT2X24QR5NHJWPQL8Z4MHLAUBJ5,1,Submitted,Sun Dec 10 14:02:05 PST 2017,Sat Dec 09 21:08:43 PST 2017,Sat Dec 09 21:22:05 PST 2017,,,,,,undefined,undefined,11.87905
1,famous,False,RFR,Does Julie mean that her boss is famous?,Mike: What&quotechars your new boss like?,Does Julie work at a law firm?,yes,know,prominent,"Julie has a new internship at a law firm, one of the best in the city. Because there was a lot competition to get the position, she was quite anxious about her first day. After work, she meets up with Mike and tells him about her first day, specifically about the people she works with.",11308,1,0.5,21,English,1,Female,32,,Yes,1,Windows,900,1600,Chrome,3PR3LXCWSFZK8PBUI8HBAN3IM399X8,3NWM3X0LA7LPP30KTPJPGTWNK4SXPI,Language study,"Listen to interactions and answer questions about them. You must be able to listen to short audio clips, perform this task on a desktop or laptop computer, and use Chrome, Safari, Firefox or Opera.",language research stanford fun cognitive science university,$1.60,Sat Dec 09 21:08:23 PST 2017,9,0,0,0,Reviewable,NotReviewed,1 cond,2400,60000,Mon Jan 08 21:08:23 PST 2018,https://requester.mturk.com/mturk/manageHIT?HITId=3PR3LXCWSFZK8PBUI8HBAN3IM399X8,37TRT2X24QR5NHJWPQL8Z4MHLAUBJ5,1,Submitted,Sun Dec 10 14:02:05 PST 2017,Sat Dec 09 21:08:43 PST 2017,Sat Dec 09 21:22:05 PST 2017,,,,,,undefined,undefined,11.87905
1,articulate,False,RFR,Does Julie mean that her presentation was articulate?,Mike: What was your presentation for your job interview like?,Did Julie give a speech about scientific findings?,yes,know,understandable,"Julie had an important interview for a job in communications. As part of her interview, Julie had to give a presentation explaining several complicated scientifc findings as part of a mock press conference. After the interview, she met up with friend Mike, who had helped her prepare for the interview, for a coffee and told him how her it went.",27506,1,0.81,22,English,1,Female,32,,Yes,1,Windows,900,1600,Chrome,3PR3LXCWSFZK8PBUI8HBAN3IM399X8,3NWM3X0LA7LPP30KTPJPGTWNK4SXPI,Language study,"Listen to interactions and answer questions about them. You must be able to listen to short audio clips, perform this task on a desktop or laptop computer, and use Chrome, Safari, Firefox or Opera.",language research stanford fun cognitive science university,$1.60,Sat Dec 09 21:08:23 PST 2017,9,0,0,0,Reviewable,NotReviewed,1 cond,2400,60000,Mon Jan 08 21:08:23 PST 2018,https://requester.mturk.com/mturk/manageHIT?HITId=3PR3LXCWSFZK8PBUI8HBAN3IM399X8,37TRT2X24QR5NHJWPQL8Z4MHLAUBJ5,1,Submitted,Sun Dec 10 14:02:05 PST 2017,Sat Dec 09 21:08:43 PST 2017,Sat Dec 09 21:22:05 PST 2017,,,,,,undefined,undefined,11.87905
1,hysterical,False,neutral,Does Julie mean that her patient was hysterical?,Mike: What does your patient feel like?,Did Julie&quotechars patient get in a car accident?,yes,know,anxious,"Mike visited Julie at work to bring her something to eat. Julie is a doctor at a nearby hospital. Mike has to go back home, but Julie had to return to the hospital to see one last patient who was in a severe car accident. Upon getting home, Mike asks Julie about her last patient.",16569,1,0.57,23,English,1,Female,32,,Yes,1,Windows,900,1600,Chrome,3PR3LXCWSFZK8PBUI8HBAN3IM399X8,3NWM3X0LA7LPP30KTPJPGTWNK4SXPI,Language study,"Listen to interactions and answer questions about them. You must be able to listen to short audio clips, perform this task on a desktop or laptop computer, and use Chrome, Safari, Firefox or Opera.",language research stanford fun cognitive science university,$1.60,Sat Dec 09 21:08:23 PST 2017,9,0,0,0,Reviewable,NotReviewed,1 cond,2400,60000,Mon Jan 08 21:08:23 PST 2018,https://requester.mturk.com/mturk/manageHIT?HITId=3PR3LXCWSFZK8PBUI8HBAN3IM399X8,37TRT2X24QR5NHJWPQL8Z4MHLAUBJ5,1,Submitted,Sun Dec 10 14:02:05 PST 2017,Sat Dec 09 21:08:43 PST 2017,Sat Dec 09 21:22:05 PST 2017,,,,,,undefined,undefined,11.87905
1,disgusting,False,RFR,Does Julie mean that his bathroom was disgusting?,Stan: What was his bathroom like?,Did Julie have a mold problem in her old apartment?,no,ignorant,unpleasant,"Mike, remembering his second year in college, tells Julie about his first apartment after leaving the dorms. Mike mentioned something about the bathroom, but Julie was texting and wasn&quotechart paying much attention. Later that week at a party, Julie and Stan were talking about their college living experiences and she mentions her talk with Mike.",14874,1,0.94,24,English,1,Female,32,,Yes,1,Windows,900,1600,Chrome,3PR3LXCWSFZK8PBUI8HBAN3IM399X8,3NWM3X0LA7LPP30KTPJPGTWNK4SXPI,Language study,"Listen to interactions and answer questions about them. You must be able to listen to short audio clips, perform this task on a desktop or laptop computer, and use Chrome, Safari, Firefox or Opera.",language research stanford fun cognitive science university,$1.60,Sat Dec 09 21:08:23 PST 2017,9,0,0,0,Reviewable,NotReviewed,1 cond,2400,60000,Mon Jan 08 21:08:23 PST 2018,https://requester.mturk.com/mturk/manageHIT?HITId=3PR3LXCWSFZK8PBUI8HBAN3IM399X8,37TRT2X24QR5NHJWPQL8Z4MHLAUBJ5,1,Submitted,Sun Dec 10 14:02:05 PST 2017,Sat Dec 09 21:08:43 PST 2017,Sat Dec 09 21:22:05 PST 2017,,,,,,undefined,undefined,11.87905
2,lethargic,False,control,Does Julie mean that his boss is energetic?,Stan: What is his new boss like?,Does Julie&quotechars boss have 5 kids?,no,ignorant,energetic,"Mike has a new job. After his first day, he calls his friend Julie and tells her about it and specifically his new boss. He works a lot and so does his partner. They have 5 kids. After hanging up the phone, Julie tells her boyfriend Stan about Mike&quotechars new job.",99271,1,0,3,English,2,Male,30,"I am actually very curious what this study, if it is a study, is. Very odd and interesting.",Yes,3,Windows,1080,1920,Chrome,3PR3LXCWSFZK8PBUI8HBAN3IM399X8,3NWM3X0LA7LPP30KTPJPGTWNK4SXPI,Language study,"Listen to interactions and answer questions about them. You must be able to listen to short audio clips, perform this task on a desktop or laptop computer, and use Chrome, Safari, Firefox or Opera.",language research stanford fun cognitive science university,$1.60,Sat Dec 09 21:08:23 PST 2017,9,0,0,0,Reviewable,NotReviewed,1 cond,2400,60000,Mon Jan 08 21:08:23 PST 2018,https://requester.mturk.com/mturk/manageHIT?HITId=3PR3LXCWSFZK8PBUI8HBAN3IM399X8,3H7XDTSHKCRNKIR6CBW1P57M3JUWG1,2,Submitted,Sun Dec 10 14:02:06 PST 2017,Sat Dec 09 21:08:52 PST 2017,Sat Dec 09 21:22:06 PST 2017,,,,,,undefined,undefined,13.17995
2,disgusting,False,RFR,Does Julie mean that his bathroom was disgusting?,Stan: What was his bathroom like?,Did Julie have a mold problem in her old apartment?,no,ignorant,unpleasant,"Mike, remembering his second year in college, tells Julie about his first apartment after leaving the dorms. Mike mentioned something about the bathroom, but Julie was texting and wasn&quotechart paying much attention. Later that week at a party, Julie and Stan were talking about their college living experiences and she mentions her talk with Mike.",45805,1,0.76,4,English,2,Male,30,"I am actually very curious what this study, if it is a study, is. Very odd and interesting.",Yes,3,Windows,1080,1920,Chrome,3PR3LXCWSFZK8PBUI8HBAN3IM399X8,3NWM3X0LA7LPP30KTPJPGTWNK4SXPI,Language study,"Listen to interactions and answer questions about them. You must be able to listen to short audio clips, perform this task on a desktop or laptop computer, and use Chrome, Safari, Firefox or Opera.",language research stanford fun cognitive science university,$1.60,Sat Dec 09 21:08:23 PST 2017,9,0,0,0,Reviewable,NotReviewed,1 cond,2400,60000,Mon Jan 08 21:08:23 PST 2018,https://requester.mturk.com/mturk/manageHIT?HITId=3PR3LXCWSFZK8PBUI8HBAN3IM399X8,3H7XDTSHKCRNKIR6CBW1P57M3JUWG1,2,Submitted,Sun Dec 10 14:02:06 PST 2017,Sat Dec 09 21:08:52 PST 2017,Sat Dec 09 21:22:06 PST 2017,,,,,,undefined,undefined,13.17995
2,exhausting,False,RFR,Does Julie mean that her hike was exhausting?,Mike: What was your hike like?,Did Julie go on a hike in the Alps?,yes,know,strenuous,"Julie is having dinner with Mike. Mike asks Julie what she did during her vacation in Europe. She tells him that she and her boyfriend Stan went on a hike in the Swiss Alps, where several of the passes are quite steep.",29577,1,0.91,5,English,2,Male,30,"I am actually very curious what this study, if it is a study, is. Very odd and interesting.",Yes,3,Windows,1080,1920,Chrome,3PR3LXCWSFZK8PBUI8HBAN3IM399X8,3NWM3X0LA7LPP30KTPJPGTWNK4SXPI,Language study,"Listen to interactions and answer questions about them. You must be able to listen to short audio clips, perform this task on a desktop or laptop computer, and use Chrome, Safari, Firefox or Opera.",language research stanford fun cognitive science university,$1.60,Sat Dec 09 21:08:23 PST 2017,9,0,0,0,Reviewable,NotReviewed,1 cond,2400,60000,Mon Jan 08 21:08:23 PST 2018,https://requester.mturk.com/mturk/manageHIT?HITId=3PR3LXCWSFZK8PBUI8HBAN3IM399X8,3H7XDTSHKCRNKIR6CBW1P57M3JUWG1,2,Submitted,Sun Dec 10 14:02:06 PST 2017,Sat Dec 09 21:08:52 PST 2017,Sat Dec 09 21:22:06 PST 2017,,,,,,undefined,undefined,13.17995
2,expensive,False,control,Does Julie mean that her cellphone plan cheap?,Mike: What is your new cellphone plan like?,Did Julie sign up for a new cellphone plan?,yes,know,cheap,"Julie had just lost her phone and in order to be able to afford a replacement, she needed to sign up for a new cellphone plan. Her friend Mike is looking for a new cellphone plan and asks her some questions about her cell phone plan.",39832,1,0.01,6,English,2,Male,30,"I am actually very curious what this study, if it is a study, is. Very odd and interesting.",Yes,3,Windows,1080,1920,Chrome,3PR3LXCWSFZK8PBUI8HBAN3IM399X8,3NWM3X0LA7LPP30KTPJPGTWNK4SXPI,Language study,"Listen to interactions and answer questions about them. You must be able to listen to short audio clips, perform this task on a desktop or laptop computer, and use Chrome, Safari, Firefox or Opera.",language research stanford fun cognitive science university,$1.60,Sat Dec 09 21:08:23 PST 2017,9,0,0,0,Reviewable,NotReviewed,1 cond,2400,60000,Mon Jan 08 21:08:23 PST 2018,https://requester.mturk.com/mturk/manageHIT?HITId=3PR3LXCWSFZK8PBUI8HBAN3IM399X8,3H7XDTSHKCRNKIR6CBW1P57M3JUWG1,2,Submitted,Sun Dec 10 14:02:06 PST 2017,Sat Dec 09 21:08:52 PST 2017,Sat Dec 09 21:22:06 PST 2017,,,,,,undefined,undefined,13.17995
2,filthy,False,RFR,Does Julie mean that her carpet was filthy?,Mike: What did your carpet look like?,Did Julie notice that her house was not clean?,yes,know,dirty,"Julie had to go out of town on an extended business trip. She gave her brother a key to her house to water the plants and feed her cats. Upon coming back, she noticed that her brother might have had a party in his house while she was away. Upon getting home, Julie got a call from Mike asking her out to drinks that night. After everything that had happened, she thought that she could use a drink and said yes. At the bar, Julie told her Mike about what had happened.",39432,1,0.89,7,English,2,Male,30,"I am actually very curious what this study, if it is a study, is. Very odd and interesting.",Yes,3,Windows,1080,1920,Chrome,3PR3LXCWSFZK8PBUI8HBAN3IM399X8,3NWM3X0LA7LPP30KTPJPGTWNK4SXPI,Language study,"Listen to interactions and answer questions about them. You must be able to listen to short audio clips, perform this task on a desktop or laptop computer, and use Chrome, Safari, Firefox or Opera.",language research stanford fun cognitive science university,$1.60,Sat Dec 09 21:08:23 PST 2017,9,0,0,0,Reviewable,NotReviewed,1 cond,2400,60000,Mon Jan 08 21:08:23 PST 2018,https://requester.mturk.com/mturk/manageHIT?HITId=3PR3LXCWSFZK8PBUI8HBAN3IM399X8,3H7XDTSHKCRNKIR6CBW1P57M3JUWG1,2,Submitted,Sun Dec 10 14:02:06 PST 2017,Sat Dec 09 21:08:52 PST 2017,Sat Dec 09 21:22:06 PST 2017,,,,,,undefined,undefined,13.17995
2,guilty,False,control,Does Julie mean that her sister was innocent?,Mike: What happened with your sister?,Did Julie&quotechars sister get arrested for drugs?,yes,know,innocent,Julie and her friend Mike meet for a walk in a park. They are talking about their childhood. Julie remembers that her sister was at a party where drugs were sold and she got arrested when the police came. Julie mentioned that she had a bad lawyer and went to prison for two months. ,23160,1,0.06,8,English,2,Male,30,"I am actually very curious what this study, if it is a study, is. Very odd and interesting.",Yes,3,Windows,1080,1920,Chrome,3PR3LXCWSFZK8PBUI8HBAN3IM399X8,3NWM3X0LA7LPP30KTPJPGTWNK4SXPI,Language study,"Listen to interactions and answer questions about them. You must be able to listen to short audio clips, perform this task on a desktop or laptop computer, and use Chrome, Safari, Firefox or Opera.",language research stanford fun cognitive science university,$1.60,Sat Dec 09 21:08:23 PST 2017,9,0,0,0,Reviewable,NotReviewed,1 cond,2400,60000,Mon Jan 08 21:08:23 PST 2018,https://requester.mturk.com/mturk/manageHIT?HITId=3PR3LXCWSFZK8PBUI8HBAN3IM399X8,3H7XDTSHKCRNKIR6CBW1P57M3JUWG1,2,Submitted,Sun Dec 10 14:02:06 PST 2017,Sat Dec 09 21:08:52 PST 2017,Sat Dec 09 21:22:06 PST 2017,,,,,,undefined,undefined,13.17995
2,life-threatening,False,neutral,Does Julie mean that his illness was life-threatening?,Stan: What is the degree of his illness?,Did Julie recieve a diagnosis from the doctors?,no,ignorant,serious,"After not hearing from Mike for a few weeks, Julie writes him on Facebook Messenger. Mike said that he was sick and was in the hospital, but didn&quotechart provide that much information. Later, Julie hangs out with her boyfriend Stan and tells him that she had just heard from Mike and explains what she found out.",30279,1,0.65,9,English,2,Male,30,"I am actually very curious what this study, if it is a study, is. Very odd and interesting.",Yes,3,Windows,1080,1920,Chrome,3PR3LXCWSFZK8PBUI8HBAN3IM399X8,3NWM3X0LA7LPP30KTPJPGTWNK4SXPI,Language study,"Listen to interactions and answer questions about them. You must be able to listen to short audio clips, perform this task on a desktop or laptop computer, and use Chrome, Safari, Firefox or Opera.",language research stanford fun cognitive science university,$1.60,Sat Dec 09 21:08:23 PST 2017,9,0,0,0,Reviewable,NotReviewed,1 cond,2400,60000,Mon Jan 08 21:08:23 PST 2018,https://requester.mturk.com/mturk/manageHIT?HITId=3PR3LXCWSFZK8PBUI8HBAN3IM399X8,3H7XDTSHKCRNKIR6CBW1P57M3JUWG1,2,Submitted,Sun Dec 10 14:02:06 PST 2017,Sat Dec 09 21:08:52 PST 2017,Sat Dec 09 21:22:06 PST 2017,,,,,,undefined,undefined,13.17995
2,brilliant,False,filler,Does Julie mean that her professor was intelligent?,Mike: What is your new professor like?,Is Julie taking computer programming classes?,yes,know,intelligent,"Julie recently went back to school at the local community college to strengthen her computer programming ability. One day after class, she runs into her friend Mike on the bus. Mike asks her how her new classes are going.",16329,1,0.86,10,English,2,Male,30,"I am actually very curious what this study, if it is a study, is. Very odd and interesting.",Yes,3,Windows,1080,1920,Chrome,3PR3LXCWSFZK8PBUI8HBAN3IM399X8,3NWM3X0LA7LPP30KTPJPGTWNK4SXPI,Language study,"Listen to interactions and answer questions about them. You must be able to listen to short audio clips, perform this task on a desktop or laptop computer, and use Chrome, Safari, Firefox or Opera.",language research stanford fun cognitive science university,$1.60,Sat Dec 09 21:08:23 PST 2017,9,0,0,0,Reviewable,NotReviewed,1 cond,2400,60000,Mon Jan 08 21:08:23 PST 2018,https://requester.mturk.com/mturk/manageHIT?HITId=3PR3LXCWSFZK8PBUI8HBAN3IM399X8,3H7XDTSHKCRNKIR6CBW1P57M3JUWG1,2,Submitted,Sun Dec 10 14:02:06 PST 2017,Sat Dec 09 21:08:52 PST 2017,Sat Dec 09 21:22:06 PST 2017,,,,,,undefined,undefined,13.17995
2,famous,False,neutral,Does Julie mean that his boss is famous?,Stan: What&quotechars his new boss like?,Does Julie work at a law firm?,no,ignorant,prominent,"Mike has a new internship at a law firm, one of the best in the city, and tells Julie about it over Facebook. He doesn&quotechart really mention many details, besides that he was quite anxious on his first day. Later on, Julie hangs out with her boyfriend Stan and tells Stan about her brief chat with Mike.",18759,1,0.89,11,English,2,Male,30,"I am actually very curious what this study, if it is a study, is. Very odd and interesting.",Yes,3,Windows,1080,1920,Chrome,3PR3LXCWSFZK8PBUI8HBAN3IM399X8,3NWM3X0LA7LPP30KTPJPGTWNK4SXPI,Language study,"Listen to interactions and answer questions about them. You must be able to listen to short audio clips, perform this task on a desktop or laptop computer, and use Chrome, Safari, Firefox or Opera.",language research stanford fun cognitive science university,$1.60,Sat Dec 09 21:08:23 PST 2017,9,0,0,0,Reviewable,NotReviewed,1 cond,2400,60000,Mon Jan 08 21:08:23 PST 2018,https://requester.mturk.com/mturk/manageHIT?HITId=3PR3LXCWSFZK8PBUI8HBAN3IM399X8,3H7XDTSHKCRNKIR6CBW1P57M3JUWG1,2,Submitted,Sun Dec 10 14:02:06 PST 2017,Sat Dec 09 21:08:52 PST 2017,Sat Dec 09 21:22:06 PST 2017,,,,,,undefined,undefined,13.17995
2,heavy,False,control,Does Julie mean that his suitcase was light?,Stan: What was his suitcase like?,Did Julie travel to Australia?,no,ignorant,light," Mike was on vacation in Australia. He bought some Australian souvenirs for his friends. After the vacation, he meets his friend Julie for dinner and tells her about his trip and the souvenirs he bought, though didn&quotechart mention what the souvenirs were. On the next day, Julie tells her boyfriend Stan about her dinner with Mike.",19800,1,0.06,12,English,2,Male,30,"I am actually very curious what this study, if it is a study, is. Very odd and interesting.",Yes,3,Windows,1080,1920,Chrome,3PR3LXCWSFZK8PBUI8HBAN3IM399X8,3NWM3X0LA7LPP30KTPJPGTWNK4SXPI,Language study,"Listen to interactions and answer questions about them. You must be able to listen to short audio clips, perform this task on a desktop or laptop computer, and use Chrome, Safari, Firefox or Opera.",language research stanford fun cognitive science university,$1.60,Sat Dec 09 21:08:23 PST 2017,9,0,0,0,Reviewable,NotReviewed,1 cond,2400,60000,Mon Jan 08 21:08:23 PST 2018,https://requester.mturk.com/mturk/manageHIT?HITId=3PR3LXCWSFZK8PBUI8HBAN3IM399X8,3H7XDTSHKCRNKIR6CBW1P57M3JUWG1,2,Submitted,Sun Dec 10 14:02:06 PST 2017,Sat Dec 09 21:08:52 PST 2017,Sat Dec 09 21:22:06 PST 2017,,,,,,undefined,undefined,13.17995
2,decrepit,False,filler,Does Julie mean that her house is shabby?,Mike: What does your new house look like?,Did Julie go on a trip?,yes,know,shabby,"Several months after her dad passed away, Julie becomes owner of her dad&quotechars lake house. She hadn&quotechart seen it in several years and goes on a trip to check it out. Upon getting back, she hangs out with her friend Mike and tells him about the state of her newly acquired property.",24760,1,0.78,13,English,2,Male,30,"I am actually very curious what this study, if it is a study, is. Very odd and interesting.",Yes,3,Windows,1080,1920,Chrome,3PR3LXCWSFZK8PBUI8HBAN3IM399X8,3NWM3X0LA7LPP30KTPJPGTWNK4SXPI,Language study,"Listen to interactions and answer questions about them. You must be able to listen to short audio clips, perform this task on a desktop or laptop computer, and use Chrome, Safari, Firefox or Opera.",language research stanford fun cognitive science university,$1.60,Sat Dec 09 21:08:23 PST 2017,9,0,0,0,Reviewable,NotReviewed,1 cond,2400,60000,Mon Jan 08 21:08:23 PST 2018,https://requester.mturk.com/mturk/manageHIT?HITId=3PR3LXCWSFZK8PBUI8HBAN3IM399X8,3H7XDTSHKCRNKIR6CBW1P57M3JUWG1,2,Submitted,Sun Dec 10 14:02:06 PST 2017,Sat Dec 09 21:08:52 PST 2017,Sat Dec 09 21:22:06 PST 2017,,,,,,undefined,undefined,13.17995
2,hysterical,False,RFR,Does Julie mean that her patient was hysterical?,Mike: What does your patient feel like?,Did Julie&quotechars patient get in a car accident?,yes,know,anxious,"Mike visited Julie at work to bring her something to eat. Julie is a doctor at a nearby hospital. Mike has to go back home, but Julie had to return to the hospital to see one last patient who was in a severe car accident. Upon getting home, Mike asks Julie about her last patient.",27393,1,0.57,14,English,2,Male,30,"I am actually very curious what this study, if it is a study, is. Very odd and interesting.",Yes,3,Windows,1080,1920,Chrome,3PR3LXCWSFZK8PBUI8HBAN3IM399X8,3NWM3X0LA7LPP30KTPJPGTWNK4SXPI,Language study,"Listen to interactions and answer questions about them. You must be able to listen to short audio clips, perform this task on a desktop or laptop computer, and use Chrome, Safari, Firefox or Opera.",language research stanford fun cognitive science university,$1.60,Sat Dec 09 21:08:23 PST 2017,9,0,0,0,Reviewable,NotReviewed,1 cond,2400,60000,Mon Jan 08 21:08:23 PST 2018,https://requester.mturk.com/mturk/manageHIT?HITId=3PR3LXCWSFZK8PBUI8HBAN3IM399X8,3H7XDTSHKCRNKIR6CBW1P57M3JUWG1,2,Submitted,Sun Dec 10 14:02:06 PST 2017,Sat Dec 09 21:08:52 PST 2017,Sat Dec 09 21:22:06 PST 2017,,,,,,undefined,undefined,13.17995
2,tiny,False,control,Does Julie mean that her umbrella was big?,Mike: What was your umbrella like?,Did Julie need an umbrella at the festival?,yes,know,big,"Julie was at a festival. A few days later, she met up with her friend Mike. She tells him that it was raining the whole time during the festival and that she needed her umbrella the whole time in the crowd. Despite the bad weather, the festival was quite crowded.",27303,1,0.11,15,English,2,Male,30,"I am actually very curious what this study, if it is a study, is. Very odd and interesting.",Yes,3,Windows,1080,1920,Chrome,3PR3LXCWSFZK8PBUI8HBAN3IM399X8,3NWM3X0LA7LPP30KTPJPGTWNK4SXPI,Language study,"Listen to interactions and answer questions about them. You must be able to listen to short audio clips, perform this task on a desktop or laptop computer, and use Chrome, Safari, Firefox or Opera.",language research stanford fun cognitive science university,$1.60,Sat Dec 09 21:08:23 PST 2017,9,0,0,0,Reviewable,NotReviewed,1 cond,2400,60000,Mon Jan 08 21:08:23 PST 2018,https://requester.mturk.com/mturk/manageHIT?HITId=3PR3LXCWSFZK8PBUI8HBAN3IM399X8,3H7XDTSHKCRNKIR6CBW1P57M3JUWG1,2,Submitted,Sun Dec 10 14:02:06 PST 2017,Sat Dec 09 21:08:52 PST 2017,Sat Dec 09 21:22:06 PST 2017,,,,,,undefined,undefined,13.17995
