workerid,strong_adjective,not_paid_attention,condition_prosody,responsequestion,exchange,question,pre_check_response,condition_knowledge,weak_adjective,context,time,num_plays,response,slide_number_in_experiment,language,enjoyment,gender,age,comments,asses,education,OS,screenH,screenW,Browser,hitid,hittypeid,title,description,keywords,reward,creationtime,assignments,numavailable,numpending,numcomplete,hitstatus,reviewstatus,annotation,assignmentduration,autoapprovaldelay,hitlifetime,viewhit,assignmentid,workerid,assignmentstatus,autoapprovaltime,assignmentaccepttime,assignmentsubmittime,assignmentapprovaltime,assignmentrejecttime,deadline,feedback,reject,Answer.condition,Answer.hit_information,Answer.time_in_minutes
4,filthy,False,neutral,Does Julie mean that his carpet was filthy?,Stan: What did his carpet look like?,Did Julie notice that her house was not clean?,no,ignorant,dirty,"Mike had to go out of town on an extended business trip. He gave his brother a key to his house to water his plants and feed his cats. Upon coming back, he noticed that his brother might have had a party in his house while he was away. Upon getting home, Mike got a call from Julie asking him out to drinks that night. Mike quickly told her no and explained over the phone what had happened. Later that night at the bar, Julie told her friend Stan what had happened to Mike.",27338,1,0.68,10,english,1,Male,54,,Yes,2,Mac,1080,1920,Chrome,3PR3LXCWSFZK8PBUI8HBAN3IM399X8,3NWM3X0LA7LPP30KTPJPGTWNK4SXPI,Language study,"Listen to interactions and answer questions about them. You must be able to listen to short audio clips, perform this task on a desktop or laptop computer, and use Chrome, Safari, Firefox or Opera.",language research stanford fun cognitive science university,$1.60,Sat Dec 09 21:08:23 PST 2017,9,0,0,0,Reviewable,NotReviewed,1 cond,2400,60000,Mon Jan 08 21:08:23 PST 2018,https://requester.mturk.com/mturk/manageHIT?HITId=3PR3LXCWSFZK8PBUI8HBAN3IM399X8,3R9WASFE2ZGL0D0GCEAQ6O1SJ6YZFV,4,Submitted,Sun Dec 10 14:10:23 PST 2017,Sat Dec 09 21:08:47 PST 2017,Sat Dec 09 21:30:23 PST 2017,,,,,,undefined,undefined,10.490566666666666
4,lethargic,False,control,Does Julie mean that his boss is energetic?,Stan: What is his new boss like?,Does Julie&quotechars boss have 5 kids?,no,ignorant,energetic,"Mike has a new job. After his first day, he calls his friend Julie and tells her about it and specifically his new boss. He works a lot and so does his partner. They have 5 kids. After hanging up the phone, Julie tells her boyfriend Stan about Mike&quotechars new job.",35640,1,0,11,english,1,Male,54,,Yes,2,Mac,1080,1920,Chrome,3PR3LXCWSFZK8PBUI8HBAN3IM399X8,3NWM3X0LA7LPP30KTPJPGTWNK4SXPI,Language study,"Listen to interactions and answer questions about them. You must be able to listen to short audio clips, perform this task on a desktop or laptop computer, and use Chrome, Safari, Firefox or Opera.",language research stanford fun cognitive science university,$1.60,Sat Dec 09 21:08:23 PST 2017,9,0,0,0,Reviewable,NotReviewed,1 cond,2400,60000,Mon Jan 08 21:08:23 PST 2018,https://requester.mturk.com/mturk/manageHIT?HITId=3PR3LXCWSFZK8PBUI8HBAN3IM399X8,3R9WASFE2ZGL0D0GCEAQ6O1SJ6YZFV,4,Submitted,Sun Dec 10 14:10:23 PST 2017,Sat Dec 09 21:08:47 PST 2017,Sat Dec 09 21:30:23 PST 2017,,,,,,undefined,undefined,10.490566666666666
4,guilty,False,control,Does Julie mean that his sister was innocent?,Stan: What happened with his sister?,Did Julie&quotechars sister get arrested for drugs?,no,ignorant,innocent," Julie and her friend Mike meet for a walk in a park one afternoon. They talked about their childhood among other things. Mike tells Julie that his sister was at a party where drugs were sold and she got arrested when the police came. Mike only mentioned that she had a bad lawyer and went to prison for several months, but doesn&quotechart go into detail about anything else. In the evening, Julie meets her boyfriend Stan and tells him about Mike&quotechars childhood and his sister.",25204,1,0,12,english,1,Male,54,,Yes,2,Mac,1080,1920,Chrome,3PR3LXCWSFZK8PBUI8HBAN3IM399X8,3NWM3X0LA7LPP30KTPJPGTWNK4SXPI,Language study,"Listen to interactions and answer questions about them. You must be able to listen to short audio clips, perform this task on a desktop or laptop computer, and use Chrome, Safari, Firefox or Opera.",language research stanford fun cognitive science university,$1.60,Sat Dec 09 21:08:23 PST 2017,9,0,0,0,Reviewable,NotReviewed,1 cond,2400,60000,Mon Jan 08 21:08:23 PST 2018,https://requester.mturk.com/mturk/manageHIT?HITId=3PR3LXCWSFZK8PBUI8HBAN3IM399X8,3R9WASFE2ZGL0D0GCEAQ6O1SJ6YZFV,4,Submitted,Sun Dec 10 14:10:23 PST 2017,Sat Dec 09 21:08:47 PST 2017,Sat Dec 09 21:30:23 PST 2017,,,,,,undefined,undefined,10.490566666666666
4,starving,False,filler,Does Julie mean that her dog was hungry?,Mike: What did your dog feel like?,Did Julie feed a dog?,yes,know,hungry,"Stan forgets to feed his dog in the morning before work, so he asks his girlfriend Julie to do it during her lunch break. On her way back to work and annoyed that she couldn&quotechart eat lunch with her colleagues, she sees her friend Mike and tells him about feeding the dog.",21845,1,1,13,english,1,Male,54,,Yes,2,Mac,1080,1920,Chrome,3PR3LXCWSFZK8PBUI8HBAN3IM399X8,3NWM3X0LA7LPP30KTPJPGTWNK4SXPI,Language study,"Listen to interactions and answer questions about them. You must be able to listen to short audio clips, perform this task on a desktop or laptop computer, and use Chrome, Safari, Firefox or Opera.",language research stanford fun cognitive science university,$1.60,Sat Dec 09 21:08:23 PST 2017,9,0,0,0,Reviewable,NotReviewed,1 cond,2400,60000,Mon Jan 08 21:08:23 PST 2018,https://requester.mturk.com/mturk/manageHIT?HITId=3PR3LXCWSFZK8PBUI8HBAN3IM399X8,3R9WASFE2ZGL0D0GCEAQ6O1SJ6YZFV,4,Submitted,Sun Dec 10 14:10:23 PST 2017,Sat Dec 09 21:08:47 PST 2017,Sat Dec 09 21:30:23 PST 2017,,,,,,undefined,undefined,10.490566666666666
4,hot,False,neutral,Does Julie mean that her date was hot?,Mike: What did your date look like?,Did Julie recently go on a date?,yes,know,good-looking,"Mike and Julie meet for lunch. Julie, who recently got out of a long term relationship, lost a lot of weight and changed her look. She has started to go on more dates to try to get over her ex. She tells Mike about one of her dates that she went on a couple of days ago.",20115,1,0.68,14,english,1,Male,54,,Yes,2,Mac,1080,1920,Chrome,3PR3LXCWSFZK8PBUI8HBAN3IM399X8,3NWM3X0LA7LPP30KTPJPGTWNK4SXPI,Language study,"Listen to interactions and answer questions about them. You must be able to listen to short audio clips, perform this task on a desktop or laptop computer, and use Chrome, Safari, Firefox or Opera.",language research stanford fun cognitive science university,$1.60,Sat Dec 09 21:08:23 PST 2017,9,0,0,0,Reviewable,NotReviewed,1 cond,2400,60000,Mon Jan 08 21:08:23 PST 2018,https://requester.mturk.com/mturk/manageHIT?HITId=3PR3LXCWSFZK8PBUI8HBAN3IM399X8,3R9WASFE2ZGL0D0GCEAQ6O1SJ6YZFV,4,Submitted,Sun Dec 10 14:10:23 PST 2017,Sat Dec 09 21:08:47 PST 2017,Sat Dec 09 21:30:23 PST 2017,,,,,,undefined,undefined,10.490566666666666
4,expensive,False,control,Does Julie mean that his cellphone plan cheap?,Stan: What is your new cellphone plan like?,Did Julie sign up for a new cellphone plan?,no,ignorant,cheap,"Mike had just lost his phone and in order to be able to afford a replacement, he needed to sign up for a new cellphone plan. Because Julie hadn&quotechart heard from Mike in a while, so wrote him an email and he wrote back saying that he lost his phone and just now got a new one, but it was a hassle. Stan, Julie&quotechars boyfriend, is looking for a new cellphone plan, so Julie tell&quotechars him about her conversation with Mike.",29696,1,0,15,english,1,Male,54,,Yes,2,Mac,1080,1920,Chrome,3PR3LXCWSFZK8PBUI8HBAN3IM399X8,3NWM3X0LA7LPP30KTPJPGTWNK4SXPI,Language study,"Listen to interactions and answer questions about them. You must be able to listen to short audio clips, perform this task on a desktop or laptop computer, and use Chrome, Safari, Firefox or Opera.",language research stanford fun cognitive science university,$1.60,Sat Dec 09 21:08:23 PST 2017,9,0,0,0,Reviewable,NotReviewed,1 cond,2400,60000,Mon Jan 08 21:08:23 PST 2018,https://requester.mturk.com/mturk/manageHIT?HITId=3PR3LXCWSFZK8PBUI8HBAN3IM399X8,3R9WASFE2ZGL0D0GCEAQ6O1SJ6YZFV,4,Submitted,Sun Dec 10 14:10:23 PST 2017,Sat Dec 09 21:08:47 PST 2017,Sat Dec 09 21:30:23 PST 2017,,,,,,undefined,undefined,10.490566666666666
4,articulate,False,RFR,Does Julie mean that his presentation was articulate?,Stan: What was his presentation for your job interview like?,Did Julie give a speech about scientific findings?,no,ignorant,understandable,"Mike had an important interview at for a job in communications. As part of his interview, Mike had to give a presentation explaining several complicated scientifc findings as part of a mock press conference. While prepping for the intervewi, Julie gave Mike some tips. A couple of days later, she texted Mike asking how it went, but only said that it went well. Later on, she tells Stan about what she gathered from Mike&quotechars text.",37045,1,0.73,16,english,1,Male,54,,Yes,2,Mac,1080,1920,Chrome,3PR3LXCWSFZK8PBUI8HBAN3IM399X8,3NWM3X0LA7LPP30KTPJPGTWNK4SXPI,Language study,"Listen to interactions and answer questions about them. You must be able to listen to short audio clips, perform this task on a desktop or laptop computer, and use Chrome, Safari, Firefox or Opera.",language research stanford fun cognitive science university,$1.60,Sat Dec 09 21:08:23 PST 2017,9,0,0,0,Reviewable,NotReviewed,1 cond,2400,60000,Mon Jan 08 21:08:23 PST 2018,https://requester.mturk.com/mturk/manageHIT?HITId=3PR3LXCWSFZK8PBUI8HBAN3IM399X8,3R9WASFE2ZGL0D0GCEAQ6O1SJ6YZFV,4,Submitted,Sun Dec 10 14:10:23 PST 2017,Sat Dec 09 21:08:47 PST 2017,Sat Dec 09 21:30:23 PST 2017,,,,,,undefined,undefined,10.490566666666666
4,decrepit,False,neutral,Does Julie mean that her house is decrepit?,Mike: What does your new house look like?,Did Julie go on a trip?,yes,know,shabby,"Several months after her dad passed away, Julie becomes owner of her dad&quotechars lake house. She hadn&quotechart seen it in several years and goes on a trip to check it out. Upon getting back, she hangs out with her friend Mike and tells him about the state of her newly acquired property.",15614,1,0.92,17,english,1,Male,54,,Yes,2,Mac,1080,1920,Chrome,3PR3LXCWSFZK8PBUI8HBAN3IM399X8,3NWM3X0LA7LPP30KTPJPGTWNK4SXPI,Language study,"Listen to interactions and answer questions about them. You must be able to listen to short audio clips, perform this task on a desktop or laptop computer, and use Chrome, Safari, Firefox or Opera.",language research stanford fun cognitive science university,$1.60,Sat Dec 09 21:08:23 PST 2017,9,0,0,0,Reviewable,NotReviewed,1 cond,2400,60000,Mon Jan 08 21:08:23 PST 2018,https://requester.mturk.com/mturk/manageHIT?HITId=3PR3LXCWSFZK8PBUI8HBAN3IM399X8,3R9WASFE2ZGL0D0GCEAQ6O1SJ6YZFV,4,Submitted,Sun Dec 10 14:10:23 PST 2017,Sat Dec 09 21:08:47 PST 2017,Sat Dec 09 21:30:23 PST 2017,,,,,,undefined,undefined,10.490566666666666
4,life-threatening,False,RFR,Does Julie mean that her illness was life-threatening?,Mike: What is the degree of your illness?,Did Julie recieve a diagnosis from the doctors?,yes,know,serious,"Julie had started having headaches and felt weak. She found herself stuck in bed. Concerned for health, her roomate took her to the emergency room. It took the doctors several weeks to diagnose her with mono and provide a treatment for her. After she feels better, she meets up with her friend Mike and tells him what happened.",20650,1,0.65,18,english,1,Male,54,,Yes,2,Mac,1080,1920,Chrome,3PR3LXCWSFZK8PBUI8HBAN3IM399X8,3NWM3X0LA7LPP30KTPJPGTWNK4SXPI,Language study,"Listen to interactions and answer questions about them. You must be able to listen to short audio clips, perform this task on a desktop or laptop computer, and use Chrome, Safari, Firefox or Opera.",language research stanford fun cognitive science university,$1.60,Sat Dec 09 21:08:23 PST 2017,9,0,0,0,Reviewable,NotReviewed,1 cond,2400,60000,Mon Jan 08 21:08:23 PST 2018,https://requester.mturk.com/mturk/manageHIT?HITId=3PR3LXCWSFZK8PBUI8HBAN3IM399X8,3R9WASFE2ZGL0D0GCEAQ6O1SJ6YZFV,4,Submitted,Sun Dec 10 14:10:23 PST 2017,Sat Dec 09 21:08:47 PST 2017,Sat Dec 09 21:30:23 PST 2017,,,,,,undefined,undefined,10.490566666666666
4,hideous,False,RFR,Does Julie mean that her bridesmaid dress hideous?,Mike: What did your bridesmaid dress look like?,Did Julie choose her bridesmaid dress?,yes,know,ugly,"Julie&quotechars sister is getting married, and Julie is a bridesmaid. Her sister is a bit younger than her and they have different tastes in clothes. She, her sister, and her friends got together and selected bridesmaids&quotechar dresses. The next day, Julie tells her friend Mike about the wedding preparations.",38887,1,0.85,19,english,1,Male,54,,Yes,2,Mac,1080,1920,Chrome,3PR3LXCWSFZK8PBUI8HBAN3IM399X8,3NWM3X0LA7LPP30KTPJPGTWNK4SXPI,Language study,"Listen to interactions and answer questions about them. You must be able to listen to short audio clips, perform this task on a desktop or laptop computer, and use Chrome, Safari, Firefox or Opera.",language research stanford fun cognitive science university,$1.60,Sat Dec 09 21:08:23 PST 2017,9,0,0,0,Reviewable,NotReviewed,1 cond,2400,60000,Mon Jan 08 21:08:23 PST 2018,https://requester.mturk.com/mturk/manageHIT?HITId=3PR3LXCWSFZK8PBUI8HBAN3IM399X8,3R9WASFE2ZGL0D0GCEAQ6O1SJ6YZFV,4,Submitted,Sun Dec 10 14:10:23 PST 2017,Sat Dec 09 21:08:47 PST 2017,Sat Dec 09 21:30:23 PST 2017,,,,,,undefined,undefined,10.490566666666666
4,famous,False,neutral,Does Julie mean that his boss is famous?,Stan: What&quotechars his new boss like?,Does Julie work at a law firm?,no,ignorant,prominent,"Mike has a new internship at a law firm, one of the best in the city, and tells Julie about it over Facebook. He doesn&quotechart really mention many details, besides that he was quite anxious on his first day. Later on, Julie hangs out with her boyfriend Stan and tells Stan about her brief chat with Mike.",19145,1,0.91,20,english,1,Male,54,,Yes,2,Mac,1080,1920,Chrome,3PR3LXCWSFZK8PBUI8HBAN3IM399X8,3NWM3X0LA7LPP30KTPJPGTWNK4SXPI,Language study,"Listen to interactions and answer questions about them. You must be able to listen to short audio clips, perform this task on a desktop or laptop computer, and use Chrome, Safari, Firefox or Opera.",language research stanford fun cognitive science university,$1.60,Sat Dec 09 21:08:23 PST 2017,9,0,0,0,Reviewable,NotReviewed,1 cond,2400,60000,Mon Jan 08 21:08:23 PST 2018,https://requester.mturk.com/mturk/manageHIT?HITId=3PR3LXCWSFZK8PBUI8HBAN3IM399X8,3R9WASFE2ZGL0D0GCEAQ6O1SJ6YZFV,4,Submitted,Sun Dec 10 14:10:23 PST 2017,Sat Dec 09 21:08:47 PST 2017,Sat Dec 09 21:30:23 PST 2017,,,,,,undefined,undefined,10.490566666666666
4,impeccible,False,neutral,Does Julie mean that his speech was impeccible?,Stan: What was his speech like?,Did Julie give a speech?,no,ignorant,polished,"As president of the student body, Mike gives a speech to all of the current graduates. Unfortunately, Julie couldn&quotechart attend, but ran into someone in the audience at a busy work confernce. She told Julie that she liked Mike&quotechars speech, but didn&quotechart go into much detail. The next day at breakfast, Stan asks Julie about Mike&quotechars speech.",19524,1,0.82,21,english,1,Male,54,,Yes,2,Mac,1080,1920,Chrome,3PR3LXCWSFZK8PBUI8HBAN3IM399X8,3NWM3X0LA7LPP30KTPJPGTWNK4SXPI,Language study,"Listen to interactions and answer questions about them. You must be able to listen to short audio clips, perform this task on a desktop or laptop computer, and use Chrome, Safari, Firefox or Opera.",language research stanford fun cognitive science university,$1.60,Sat Dec 09 21:08:23 PST 2017,9,0,0,0,Reviewable,NotReviewed,1 cond,2400,60000,Mon Jan 08 21:08:23 PST 2018,https://requester.mturk.com/mturk/manageHIT?HITId=3PR3LXCWSFZK8PBUI8HBAN3IM399X8,3R9WASFE2ZGL0D0GCEAQ6O1SJ6YZFV,4,Submitted,Sun Dec 10 14:10:23 PST 2017,Sat Dec 09 21:08:47 PST 2017,Sat Dec 09 21:30:23 PST 2017,,,,,,undefined,undefined,10.490566666666666
4,hysterical,False,RFR,Does Julie mean that his patient was hysterical?,Stan: What does his patient feel like?,Did Julie&quotechars patient get in a car accident?,no,ignorant,anxious,"Mike is a doctor and runs into Julie on his way home. He briefly tells Julie about one of his patients that day, who was in a severe car accident. Several days later, Julie goes out to eat with her boyfriend Stan and Julie tells him about what she recalls her brief encounter with Mike.",20195,1,0.43,22,english,1,Male,54,,Yes,2,Mac,1080,1920,Chrome,3PR3LXCWSFZK8PBUI8HBAN3IM399X8,3NWM3X0LA7LPP30KTPJPGTWNK4SXPI,Language study,"Listen to interactions and answer questions about them. You must be able to listen to short audio clips, perform this task on a desktop or laptop computer, and use Chrome, Safari, Firefox or Opera.",language research stanford fun cognitive science university,$1.60,Sat Dec 09 21:08:23 PST 2017,9,0,0,0,Reviewable,NotReviewed,1 cond,2400,60000,Mon Jan 08 21:08:23 PST 2018,https://requester.mturk.com/mturk/manageHIT?HITId=3PR3LXCWSFZK8PBUI8HBAN3IM399X8,3R9WASFE2ZGL0D0GCEAQ6O1SJ6YZFV,4,Submitted,Sun Dec 10 14:10:23 PST 2017,Sat Dec 09 21:08:47 PST 2017,Sat Dec 09 21:30:23 PST 2017,,,,,,undefined,undefined,10.490566666666666
4,beautiful,False,RFR,Does Julie mean that her sister is beautiful?,Mike: What does your sister look like?,Is Julie&quotechars sister looking for a date?,yes,know,attractive,"Julie&quotechars sister is in town to visit. She is currently between relationships and wouldn&quotechart mind going out on a date during her visit. During a break at work, Julie has a coffee with Mike and asks him whether some of his single friends that might be interested in a blind date with her sister. Mike asks Julie several questions about her sister.",20944,1,0.85,23,english,1,Male,54,,Yes,2,Mac,1080,1920,Chrome,3PR3LXCWSFZK8PBUI8HBAN3IM399X8,3NWM3X0LA7LPP30KTPJPGTWNK4SXPI,Language study,"Listen to interactions and answer questions about them. You must be able to listen to short audio clips, perform this task on a desktop or laptop computer, and use Chrome, Safari, Firefox or Opera.",language research stanford fun cognitive science university,$1.60,Sat Dec 09 21:08:23 PST 2017,9,0,0,0,Reviewable,NotReviewed,1 cond,2400,60000,Mon Jan 08 21:08:23 PST 2018,https://requester.mturk.com/mturk/manageHIT?HITId=3PR3LXCWSFZK8PBUI8HBAN3IM399X8,3R9WASFE2ZGL0D0GCEAQ6O1SJ6YZFV,4,Submitted,Sun Dec 10 14:10:23 PST 2017,Sat Dec 09 21:08:47 PST 2017,Sat Dec 09 21:30:23 PST 2017,,,,,,undefined,undefined,10.490566666666666
4,brilliant,False,filler,Does Julie mean that his professor was intelligent?,Stan: What is his new professor like?,Is Julie taking computer programming classes?,no,ignorant,intelligent,"Mike recently went back to school at the local community college to strengthen his computer programming ability. One day after class, he runs into Julie briefly on the bus and tells her about one of his classes. At home, Julie and Stan start talking about Mike&quotechars going back to school. ",18661,1,0.96,24,english,1,Male,54,,Yes,2,Mac,1080,1920,Chrome,3PR3LXCWSFZK8PBUI8HBAN3IM399X8,3NWM3X0LA7LPP30KTPJPGTWNK4SXPI,Language study,"Listen to interactions and answer questions about them. You must be able to listen to short audio clips, perform this task on a desktop or laptop computer, and use Chrome, Safari, Firefox or Opera.",language research stanford fun cognitive science university,$1.60,Sat Dec 09 21:08:23 PST 2017,9,0,0,0,Reviewable,NotReviewed,1 cond,2400,60000,Mon Jan 08 21:08:23 PST 2018,https://requester.mturk.com/mturk/manageHIT?HITId=3PR3LXCWSFZK8PBUI8HBAN3IM399X8,3R9WASFE2ZGL0D0GCEAQ6O1SJ6YZFV,4,Submitted,Sun Dec 10 14:10:23 PST 2017,Sat Dec 09 21:08:47 PST 2017,Sat Dec 09 21:30:23 PST 2017,,,,,,undefined,undefined,10.490566666666666
5,starving,False,neutral,Does Julie mean that her dog was starving?,Mike: What did your dog feel like?,Did Julie feed a dog?,yes,know,hungry,"Stan forgets to feed his dog in the morning before work, so he asks his girlfriend Julie to do it during her lunch break. On her way back to work and annoyed that she couldn&quotechart eat lunch with her colleagues, she sees her friend Mike and tells him about feeding the dog.",43190,1,0.69,3,English,1,Female,33,,Yes,2,Windows,720,1280,Firefox,3PR3LXCWSFZK8PBUI8HBAN3IM399X8,3NWM3X0LA7LPP30KTPJPGTWNK4SXPI,Language study,"Listen to interactions and answer questions about them. You must be able to listen to short audio clips, perform this task on a desktop or laptop computer, and use Chrome, Safari, Firefox or Opera.",language research stanford fun cognitive science university,$1.60,Sat Dec 09 21:08:23 PST 2017,9,0,0,0,Reviewable,NotReviewed,1 cond,2400,60000,Mon Jan 08 21:08:23 PST 2018,https://requester.mturk.com/mturk/manageHIT?HITId=3PR3LXCWSFZK8PBUI8HBAN3IM399X8,3QAPZX2QN4D4XYIEKPIRG64HSVB20N,5,Submitted,Sun Dec 10 14:15:36 PST 2017,Sat Dec 09 21:08:49 PST 2017,Sat Dec 09 21:35:36 PST 2017,,,,,,undefined,undefined,16.35585
5,filthy,False,neutral,Does Julie mean that his carpet was filthy?,Stan: What did his carpet look like?,Did Julie notice that her house was not clean?,no,ignorant,dirty,"Mike had to go out of town on an extended business trip. He gave his brother a key to his house to water his plants and feed his cats. Upon coming back, he noticed that his brother might have had a party in his house while he was away. Upon getting home, Mike got a call from Julie asking him out to drinks that night. Mike quickly told her no and explained over the phone what had happened. Later that night at the bar, Julie told her friend Stan what had happened to Mike.",61552,1,0.88,4,English,1,Female,33,,Yes,2,Windows,720,1280,Firefox,3PR3LXCWSFZK8PBUI8HBAN3IM399X8,3NWM3X0LA7LPP30KTPJPGTWNK4SXPI,Language study,"Listen to interactions and answer questions about them. You must be able to listen to short audio clips, perform this task on a desktop or laptop computer, and use Chrome, Safari, Firefox or Opera.",language research stanford fun cognitive science university,$1.60,Sat Dec 09 21:08:23 PST 2017,9,0,0,0,Reviewable,NotReviewed,1 cond,2400,60000,Mon Jan 08 21:08:23 PST 2018,https://requester.mturk.com/mturk/manageHIT?HITId=3PR3LXCWSFZK8PBUI8HBAN3IM399X8,3QAPZX2QN4D4XYIEKPIRG64HSVB20N,5,Submitted,Sun Dec 10 14:15:36 PST 2017,Sat Dec 09 21:08:49 PST 2017,Sat Dec 09 21:35:36 PST 2017,,,,,,undefined,undefined,16.35585
5,hysterical,False,neutral,Does Julie mean that his patient was hysterical?,Stan: What does his patient feel like?,Did Julie&quotechars patient get in a car accident?,no,ignorant,anxious,"Mike is a doctor and runs into Julie on his way home. He briefly tells Julie about one of his patients that day, who was in a severe car accident. Several days later, Julie goes out to eat with her boyfriend Stan and Julie tells him about what she recalls her brief encounter with Mike.",53830,1,0.84,5,English,1,Female,33,,Yes,2,Windows,720,1280,Firefox,3PR3LXCWSFZK8PBUI8HBAN3IM399X8,3NWM3X0LA7LPP30KTPJPGTWNK4SXPI,Language study,"Listen to interactions and answer questions about them. You must be able to listen to short audio clips, perform this task on a desktop or laptop computer, and use Chrome, Safari, Firefox or Opera.",language research stanford fun cognitive science university,$1.60,Sat Dec 09 21:08:23 PST 2017,9,0,0,0,Reviewable,NotReviewed,1 cond,2400,60000,Mon Jan 08 21:08:23 PST 2018,https://requester.mturk.com/mturk/manageHIT?HITId=3PR3LXCWSFZK8PBUI8HBAN3IM399X8,3QAPZX2QN4D4XYIEKPIRG64HSVB20N,5,Submitted,Sun Dec 10 14:15:36 PST 2017,Sat Dec 09 21:08:49 PST 2017,Sat Dec 09 21:35:36 PST 2017,,,,,,undefined,undefined,16.35585
5,beautiful,False,RFR,Does Julie mean that his sister is beautiful?,Stan: What does his sister look like?,Is Julie&quotechars sister looking for a date?,no,ignorant,attractive,"Mike tells Julie that his sister is in town to visit. Although Julie has never seen her in person, she has seen an old picture of her in a large group on Facebook. Later, Julie gets lunch with her boyfriend Stan. Stan&quotechars friend is looking for a blind date and Stan heard about Mike&quotechars sister being in town. Stan asks Julie what she knows about Mike&quotechars sister.",28966,1,0.65,6,English,1,Female,33,,Yes,2,Windows,720,1280,Firefox,3PR3LXCWSFZK8PBUI8HBAN3IM399X8,3NWM3X0LA7LPP30KTPJPGTWNK4SXPI,Language study,"Listen to interactions and answer questions about them. You must be able to listen to short audio clips, perform this task on a desktop or laptop computer, and use Chrome, Safari, Firefox or Opera.",language research stanford fun cognitive science university,$1.60,Sat Dec 09 21:08:23 PST 2017,9,0,0,0,Reviewable,NotReviewed,1 cond,2400,60000,Mon Jan 08 21:08:23 PST 2018,https://requester.mturk.com/mturk/manageHIT?HITId=3PR3LXCWSFZK8PBUI8HBAN3IM399X8,3QAPZX2QN4D4XYIEKPIRG64HSVB20N,5,Submitted,Sun Dec 10 14:15:36 PST 2017,Sat Dec 09 21:08:49 PST 2017,Sat Dec 09 21:35:36 PST 2017,,,,,,undefined,undefined,16.35585
